country,region,district,street,address
Chile,Region Metropolitana,Santiago,Diagonal Paraguay 265,Chile Region Metropolitana Santiago Diagonal Paraguay 265
Chile,Region Metropolitana,Santiago,Morandé 83,Chile Region Metropolitana Santiago Morandé 83
Chile,Region Metropolitana,Santiago,Abate Molina 91,Chile Region Metropolitana Santiago Abate Molina 91
Chile,Region Metropolitana,Santiago,Santo Domingo 1301,Chile Region Metropolitana Santiago Santo Domingo 1301
Chile,Region Metropolitana,Santiago,Catedral 2301,Chile Region Metropolitana Santiago Catedral 2301
Chile,Region Metropolitana,Independencia,Anibal Pinto 1145,Chile Region Metropolitana Independencia Anibal Pinto 1145
Chile,Region Metropolitana,Providencia,Padre Mariano 140,Chile Region Metropolitana Providencia Padre Mariano 140
